32308, the Ville, Mei Lin's apartment, main room, sp-A
32318, the Ville, Mei Lin's apartment, main room, sp-B
32313, the Ville, Dorm for Goethe Gymnasium, Klaus Mueller's room, sp-A
32323, the Ville, Dorm for Goethe Gymnasium, Klaus Mueller's room, sp-B
32294, the Ville, Dorm for Goethe Gymnasium, Maria Lopez's room, sp-A
32304, the Ville, Dorm for Goethe Gymnasium, Ayesha Khan's room, sp-A
32314, the Ville, Dorm for Goethe Gymnasium, Ayesha Khan's room, sp-B
32324, the Ville, Dorm for Goethe Gymnasium, Wolfgang Schulz's room, sp-A